{
  "protocol": "pocket-skill/v1",
  "identity": {
    "id": "example.city-notes",
    "name": "城市笔记",
    "version": "1.0.0",
    "author": "Example Author",
    "description": "把用户确认的城市笔记整理并落到地图。"
  },
  "kind": "markdown",
  "entry": { "target": "jot-agent" },
  "runtime": { "execution": "declarative", "runtime_min": "1.0.0", "platforms": ["web", "android-arm64"] },
  "permissions": { "scopes": ["location"], "tools": ["geocode", "mark_place"], "network_hosts": [] },
  "data": { "schemas": [] },
  "quality_gate": { "policy_id": "pocket.workflow-gate/v1", "checks": ["写入地图前取得用户确认"] },
  "fallback": { "order": ["rules", "user-confirmation", "stop"] },
  "evaluation": { "suite": "example-city-notes-v1", "passed": true, "score": 1, "threshold": 0.9, "tested_at": "2026-08-11T00:00:00+08:00" },
  "distribution": { "channel": "private", "manifest_url": "", "uninstall_policy": "remove-skill-assets-keep-private-data" },
  "assets": [],
  "provenance": { "source": "user-authored", "license": "private-use", "released_at": "2026-08-11T00:00:00+08:00" }
}
