{
  "protocol": "pocket-skill/v1",
  "identity": {
    "id": "example.book-mapping",
    "name": "书籍 Mapping",
    "version": "1.0.0",
    "author": "Example Author",
    "description": "LoRA 负责识读，声明式工作流负责证据审核、确址与 Data Pack 输出。"
  },
  "kind": "hybrid",
  "entry": { "target": "agent-forge", "instructions": "mapping-workflow", "adapter": "document-vision-lora" },
  "runtime": {
    "execution": "mnn", "runtime_min": "1.0.0", "platforms": ["android-arm64"],
    "base": { "id": "qwen3-vl-2b-mnn-int8", "revision": "example", "sha256": "0000000000000000000000000000000000000000000000000000000000000000" }
  },
  "permissions": { "scopes": ["location"], "tools": ["vision", "geocode", "mark_place", "data_pack"], "network_hosts": [] },
  "data": { "schemas": ["pocket.mapping/v1"] },
  "quality_gate": { "policy_id": "pocket.mapping-evidence-gate/v1", "checks": ["候选保留原文页码", "人工确址后才生成 Data Pack"] },
  "fallback": { "order": ["adapter", "base", "rules", "user-confirmation", "stop"] },
  "evaluation": { "suite": "example-book-mapping-v1", "passed": true, "score": 0.95, "threshold": 0.9, "tested_at": "2026-08-11T00:00:00+08:00" },
  "distribution": { "channel": "oss", "manifest_url": "https://oss.example.cn/skills/example.book-mapping/1.0.0/manifest.json", "uninstall_policy": "remove-skill-assets-keep-private-data" },
  "assets": [
    { "id": "mapping-workflow", "role": "instructions", "media_type": "text/markdown", "bytes": 512, "sha256": "2222222222222222222222222222222222222222222222222222222222222222", "url": "https://oss.example.cn/skills/example.book-mapping/1.0.0/assets/2222222222222222222222222222222222222222222222222222222222222222" },
    { "id": "document-vision-lora", "role": "adapter", "media_type": "application/octet-stream", "bytes": 1024, "sha256": "3333333333333333333333333333333333333333333333333333333333333333", "url": "https://oss.example.cn/skills/example.book-mapping/1.0.0/assets/3333333333333333333333333333333333333333333333333333333333333333" }
  ],
  "provenance": { "source": "example training run", "license": "private-use", "released_at": "2026-08-11T00:00:00+08:00" }
}
